<?xml version="1.0" encoding="UTF-8"?>
<xs:schema xmlns:xs="http://www.w3.org/2001/XMLSchema" elementFormDefault="qualified" targetNamespace="http://www.zurich.ibm.com/security/idemix" xmlns:xsi="http://www.w3.org/2001/XMLSchema-instance" xmlns:idemix="http://www.zurich.ibm.com/security/idemix">
  <xs:element name="Message">
    <xs:complexType>
      <xs:sequence>
        <xs:element ref="idemix:Values"/>
        <xs:element ref="idemix:TValues"/>
        <xs:element ref="idemix:IssuerAttributes" minOccurs="0"/>
        <xs:element ref="idemix:IdmxProof" minOccurs="0"/>
        <xs:element ref="idemix:Counter"/>
      </xs:sequence>
    </xs:complexType>
  </xs:element>
  <xs:element name="IdmxProof">
    <xs:complexType>
      <xs:sequence>
        <xs:element ref="idemix:Challenge"/>
        <xs:element ref="idemix:SmartcardNonce" minOccurs="0"/>
        <xs:element ref="idemix:CommonValues" minOccurs="0"/>
        <xs:element ref="idemix:Values"/>
        <xs:element ref="idemix:VerifiableEncryptions"/>
      </xs:sequence>
    </xs:complexType>
  </xs:element>
  <xs:element name="Challenge" type="xs:integer"/>
  <xs:element name="SmartcardNonce" type="xs:base64Binary"/>
  <xs:element name="CommonValues">
    <xs:complexType>
      <xs:sequence>
        <xs:element maxOccurs="unbounded" minOccurs="0" ref="idemix:CommonValue"/>
      </xs:sequence>
    </xs:complexType>
  </xs:element>
  <xs:element name="VerifiableEncryptions">
    <xs:complexType/>
  </xs:element>
  <xs:element name="Counter" type="xs:integer"/>
  <xs:element name="IssuerAttributes">
    <xs:complexType>
      <xs:sequence>
        <xs:element maxOccurs="unbounded" ref="idemix:Attribute"/>
      </xs:sequence>
    </xs:complexType>
  </xs:element>
  <xs:element name="Values">
    <xs:complexType>
      <xs:sequence>
        <xs:element maxOccurs="unbounded" ref="idemix:Value"/>
      </xs:sequence>
    </xs:complexType>
  </xs:element>
    <xs:element name="TValues">
    <xs:complexType>
      <xs:sequence>
        <xs:element maxOccurs="unbounded" name="TValue" type="xs:integer"/>
      </xs:sequence>
    </xs:complexType>
  </xs:element>
  <xs:element name="Value">
    <xs:complexType mixed="true">
      <xs:attribute name="key" type="xs:string"/>
      <xs:attribute name="name" type="xs:NCName"/>
      <xs:attribute name="type" type="xs:NCName"/>
    </xs:complexType>
  </xs:element>
  <xs:element name="CommonValue">
    <xs:complexType mixed="true">
      <xs:attribute name="key" type="xs:string"/>
    </xs:complexType>
  </xs:element>
  <xs:element name="Attribute">
    <xs:complexType mixed="true">
      <xs:attribute name="name" type="xs:string"/>
    </xs:complexType>
  </xs:element>
</xs:schema>
