<?xml version="1.0" encoding="UTF-8"?><Message xmlns="http://www.zurich.ibm.com/security/idemix" xmlns:xs="http://www.w3.org/2001/XMLSchema" xmlns:xsi="http://www.w3.org/2001/XMLSchema-instance" xsi:schemaLocation="http://www.zurich.ibm.com/security/idemix ../xsd/Message.xsd">
  <Values>
    <Value name="capA">4577203370457028103328464524009908407678530932702268969604921740432094012057267265391467549098938756160113921075018338429871253984616919712553244267534453860570061726743969128237710056258666612030637074181673648718547405470833959238541335822229329923258603946007812460664815016752977751870583672112219685670</Value>
    <Value name="vPrimePrime">1886712313377576902346742514526196255042662312355169165251575149544895673976790723668240852236092149474250307356517605719189157119239287954840638728486234075734061720039235959124433454572765281941024178385564390868300841092367043890945209756785232283556359676415160005552358029231439914681009571746269819251508424421759021745704115780932593233202154932292394190442326451304812227409891002905779720574323004672371566909587770338305</Value>
    <Value name="e">259344723055062059907025491480697571938277889515152306249728583105665800713306759149981690559193987143066508365305231362110587327836295793570784667053393280624077323010434407507031</Value>
  </Values>
  <IdmxProof>
    <Challenge>23255962444193354344946910620481830875329124423916525451458135000974000386586</Challenge>
    <CommonValues/>
    <Values>
      <Value key="s_e" type="BigInteger">27429966007171229224226308091798167765797209766178566648184671568036522919183782340091848214987095370524832799317164070272926740957198523296915069968964482070075595000015854182032680901725029814988513733375903373223520296803913662172287245844061416356472554626697180745371107467129366265642665283614895863668</Value>
    </Values>
    <TValues/>
    <VerifiableEncryptions/>
  </IdmxProof>
  <Counter>0</Counter>
</Message>