<?xml version="1.0" encoding="UTF-8"?><Message xmlns="http://www.zurich.ibm.com/security/idemix" xmlns:xs="http://www.w3.org/2001/XMLSchema" xmlns:xsi="http://www.w3.org/2001/XMLSchema-instance" xsi:schemaLocation="http://www.zurich.ibm.com/security/idemix ../xsd/Message.xsd">
  <Values>
    <Value name="nonce">1738320866966628215495</Value>
  </Values>
  <IdmxProof>
    <Challenge>1337</Challenge>
    <SmartcardNonce>AAABA4CBAAA=</SmartcardNonce>
    <CommonValues>
      <CommonValue key="gp">78485280485625733211402793534323449321117898710088543846747559831834759431000</CommonValue>
      <CommonValue key="proofSpecHash">57126760908900413522883942697884168772627305488141292388350681614281959751694</CommonValue>
      <CommonValue key="sp">19313454934015494502853372660485364277088851954979011267331898025266929871326</CommonValue>
      <CommonValue key="toBeIssued">1622329355377182628938982897654668579722678911194097865043206032547496011830870885038307240606498737152264770306667168953361162400625020274170013021833054898099426777835623948380162442558603098527835398595249877258493066058088513087726781752150663236127315286193859395348348843756358438307329593536167430105</CommonValue>
      <CommonValue key="toBeIssued;issuerPk">36208523169489658024847489255733158291125038638410703786015367110824921513092</CommonValue>
    </CommonValues>
    <Values>
      <Value key="smartcard_secret;nameOfSecret" type="BigInteger">1788176471760</Value>
      <Value key="id2" type="BigInteger">2000</Value>
      <Value key="id1" type="BigInteger">1000</Value>
      <Value key="id6" type="BigInteger">14134462673820475145873042368138791195767726747297512372046077174548130664393044139834278059429705167907779833146431091933473408264124186372799513377972874003644298773301330399</Value>
      <Value key="id4" type="BigInteger">35651001231903289640854876363647492058136551834323994950127017959976402169957243653052877048230089982564652073252980360598641751735136797006629374221884283045272672627504557258</Value>
      <Value key="toBeIssued" type="BigInteger">-1317940564176786340079984120999970631353398616621967000951335292587578823710698294326523362278355634527111880866714879196896041497243663878917332688353777738768789074088583236284881075450129753487598610197483368606876632313409057051210929157401793997783623329875495714893354642618887187595935770294384485654308329747196152018696214956580872411797854962580555824906439335094216952913795242916190785057524549573751292926964160971832637</Value>
    </Values>
    <TValues>
      <TValue>63949348182483068346172876816447946740866627240923650405141273755379447734617186518275873599144142568990435103758323750191609011285507573900008601048038384662571047326560025951260756919195027789398119250533411898664527998939303691512297942509016519109214155261784862673082162380378582049165240696299672619135</TValue>
    </TValues>
    <VerifiableEncryptions/>
  </IdmxProof>
  <Counter>1</Counter>
</Message>